{
  "schema_version": "1.1",
  "case_id": "opendev-962700",
  "project": "openstack",
  "split": "test",
  "case_kind": "independent_positive",
  "source": {
    "host": "review.opendev.org",
    "repository": "openstack/charm-zuul-jobs",
    "pull_request": {
      "provider": "gerrit",
      "number": 962700,
      "change_id": "I10e32f1be492bfc868a2308ecb82e3537ae452b3",
      "url": "https://review.opendev.org/c/openstack/charm-zuul-jobs/+/962700",
      "status": "MERGED",
      "subject": "Add 'legacy' charm templates",
      "branch": "master",
      "created": "2025-10-01 15:46:12.000000000",
      "submitted": "2025-10-02 12:56:39.000000000"
    },
    "base_commit": "787cbd521452aa42ffcee2ebf03ad9e9666b160d",
    "candidate_commit": "b4f204c6263af9097b1b977109837690eb877c9f",
    "changed_paths": [
      "zuul.d/jobs.yaml",
      "zuul.d/project-templates.yaml"
    ],
    "patch_url": "https://review.opendev.org/changes/962700/revisions/b4f204c6263af9097b1b977109837690eb877c9f/patch"
  },
  "relations": [
    {
      "source_repository": "openstack/charm-zuul-jobs",
      "target_repository": "openstack/charm-magpie",
      "relation_kind": "explicit_depends_on",
      "evidence_url": "https://review.opendev.org/c/openstack/charm-magpie/+/962687"
    }
  ],
  "targets": [
    {
      "repository": "openstack/charm-magpie",
      "pull_request": {
        "provider": "gerrit",
        "number": 962687,
        "change_id": "I899af28b297daeae1d36404d7810d2c7080960b1",
        "url": "https://review.opendev.org/c/openstack/charm-magpie/+/962687",
        "status": "MERGED",
        "subject": "Change to use 'legacy' charm job templates",
        "branch": "legacy",
        "created": "2025-10-01 15:08:29.000000000",
        "submitted": "2025-10-02 13:48:46.000000000"
      },
      "commit": "35e3362ba1b1ae48fb803902426a10da2c55a54b",
      "changed_paths": [
        ".zuul.yaml"
      ],
      "label_scope": "known_coordination",
      "impact_kind": "unclassified",
      "impact_kind_source": "unclassified",
      "expected_checks": {
        "label_kind": "unavailable",
        "paths": [],
        "symbols": [],
        "tests": [],
        "commands": [],
        "expected_result": "coordination_observed"
      },
      "evidence": [
        {
          "level": "coordination_proven",
          "kind": "depends_on_trailer_and_merged_change",
          "url": "https://review.opendev.org/c/openstack/charm-magpie/+/962687",
          "statement": "Depends-On: https://review.opendev.org/c/openstack/charm-zuul-jobs/+/962700",
          "ci_url": "https://zuul.opendev.org/t/openstack/buildset/c6a9d4438b5b4cc7a462186878cc17b0"
        }
      ]
    }
  ],
  "label_source": {
    "kind": "independent_project_evidence",
    "derived_from_marshal_config": false
  },
  "licenses": [
    {
      "repository": "openstack/charm-magpie",
      "spdx": "Apache-2.0",
      "evidence_url": "https://opendev.org/openstack/charm-magpie/raw/commit/35e3362ba1b1ae48fb803902426a10da2c55a54b/LICENSE"
    },
    {
      "repository": "openstack/charm-zuul-jobs",
      "spdx": "NOASSERTION",
      "evidence_url": "https://opendev.org/openstack/charm-zuul-jobs/src/commit/b4f204c6263af9097b1b977109837690eb877c9f"
    }
  ],
  "provenance": {
    "collector": "collect_opendev.py",
    "collected_at": "2026-08-22",
    "query": "message:\"Depends-On:\" status:merged"
  }
}
