{
  "schema_version": "1.1",
  "case_id": "github-kubernetes-enhancements-5152",
  "project": "kubernetes",
  "split": "test",
  "case_kind": "independent_positive",
  "source": {
    "host": "github.com",
    "repository": "kubernetes/enhancements",
    "pull_request": {
      "provider": "github",
      "number": 5152,
      "change_id": "kubernetes/enhancements#5152",
      "url": "https://github.com/kubernetes/enhancements/pull/5152",
      "status": "MERGED",
      "subject": "KEP-4444: Rename PreferClose to PreferSameZone",
      "branch": "master",
      "created": "2025-02-07T05:50:48Z",
      "submitted": "2025-02-11T19:45:58Z"
    },
    "base_commit": "e0fc7849b2ecc4ab1daf32346e273596cf01c24d",
    "candidate_commit": "b3db9beb9c087e0464493a70e24921ee31e8cdca",
    "changed_paths": [
      "keps/sig-network/4444-service-traffic-distribution/README.md",
      "keps/sig-network/4444-service-traffic-distribution/kep.yaml"
    ],
    "patch_url": "https://github.com/kubernetes/enhancements/compare/e0fc7849b2ecc4ab1daf32346e273596cf01c24d...b3db9beb9c087e0464493a70e24921ee31e8cdca.patch"
  },
  "relations": [
    {
      "source_repository": "kubernetes/enhancements",
      "target_repository": "kubernetes/kubernetes",
      "relation_kind": "specification_implementation",
      "evidence_url": "https://github.com/kubernetes/kubernetes/pull/130673"
    }
  ],
  "targets": [
    {
      "repository": "kubernetes/kubernetes",
      "pull_request": {
        "provider": "github",
        "number": 130673,
        "change_id": "kubernetes/kubernetes#130673",
        "url": "https://github.com/kubernetes/kubernetes/pull/130673",
        "status": "MERGED",
        "subject": "Promote ServiceTrafficDistribution feature-gate to GA and update docs with latest descriptions",
        "branch": "master",
        "created": "2025-03-10T01:00:05Z",
        "submitted": "2025-03-12T15:23:47Z"
      },
      "commit": "dc8061881773827aefc90d9f3d5ca7381b681d7a",
      "changed_paths": [
        "api/openapi-spec/swagger.json",
        "api/openapi-spec/v3/api__v1_openapi.json",
        "pkg/apis/core/types.go",
        "pkg/features/versioned_kube_features.go",
        "pkg/generated/openapi/zz_generated.openapi.go",
        "pkg/proxy/topology.go",
        "pkg/proxy/topology_test.go",
        "staging/src/k8s.io/api/core/v1/generated.proto",
        "staging/src/k8s.io/api/core/v1/types.go",
        "staging/src/k8s.io/api/core/v1/types_swagger_doc_generated.go",
        "test/featuregates_linter/test_data/versioned_feature_list.yaml",
        "test/integration/service/service_test.go"
      ],
      "label_scope": "causal_impact",
      "impact_kind": "unclassified",
      "impact_kind_source": "unclassified",
      "expected_checks": {
        "label_kind": "unavailable",
        "paths": [],
        "symbols": [],
        "tests": [],
        "commands": [],
        "expected_result": "coordinated_change_required"
      },
      "evidence": [
        {
          "level": "specification_proven",
          "kind": "explicit_specification_to_implementation_reference",
          "url": "https://github.com/kubernetes/kubernetes/pull/130673",
          "statement": "目标按源 KEP 的讨论和里程碑提升流量分布能力并同步描述。",
          "ci_url": null
        }
      ]
    }
  ],
  "label_source": {
    "kind": "independent_project_evidence",
    "derived_from_marshal_config": false
  },
  "licenses": [
    {
      "repository": "kubernetes/enhancements",
      "spdx": "Apache-2.0",
      "evidence_url": "https://github.com/kubernetes/enhancements/blob/master/LICENSE"
    },
    {
      "repository": "kubernetes/kubernetes",
      "spdx": "Apache-2.0",
      "evidence_url": "https://github.com/kubernetes/kubernetes/blob/master/LICENSE"
    }
  ],
  "provenance": {
    "collector": "collect_github_spec_candidates.py + manual review + opening snapshot recovery",
    "collected_at": "2026-08-23",
    "query": "merged target PR explicitly linking a source specification PR"
  }
}
